title,compound,datetime
Canada makes submarine procurement announcement after days of defence-spending criticism from NATO allies,-0.4404,2024-07-10 17:19:55.911666
"Atlantic Canada next in line for a soaking, flood risk from Beryl remnants",-0.2732,2024-07-10 17:19:55.928216
'I'm just so proud of them': Former Winnipegger in stands cheering on Canada at Copa America 2024 semifinals,0.8069,2024-07-10 17:19:55.945371
"Conrad Black, who battled Chrétien over British peerage, removed from U.K. House of Lords",-0.296,2024-07-10 17:19:55.961451
Ford digs in on booze sales expansion plan as LCBO strike drags on,-0.296,2024-07-10 18:19:45.438555
Eels on a plane: Slippery specimens escape aircraft at Vancouver airport,0.1779,2024-07-10 18:19:45.448172
Source Atlantic being sold to Lawson Canada,0.0,2024-07-10 18:19:55.911666
Costco to increase annual membership fee to $65 this September,0.3182,2024-07-10 18:19:55.928216
Federal government to offer NATO a 'timeline' for boosting defence spending,0.4215,2024-07-10 18:19:55.945371
Newfoundland fish harvesters crash news conference to demand reinstating of cod moratorium,-0.4939,2024-07-10 19:19:45.438555
Alberta will see more frequent extreme weather: Environment Canada,0.0,2024-07-10 19:19:45.448172
Eels writhe on Vancouver airport tarmac after escaping from box,0.0516,2024-07-10 19:19:55.928216
Marsch: Copa can 'change trajectory' of Canada,0.0,2024-07-10 19:19:55.945371
Canada's soccer success fuels youth participation,0.5719,2024-07-10 20:19:45.407336
"Team Canada rises above racist comment, wins world ball hockey championship",0.3818,2024-07-10 20:19:55.911666
Workers at Shell's Canada unit ratify new deal,0.0,2024-07-10 20:19:55.928216
Canada criticized for NATO spending,-0.3612,2024-07-10 20:19:55.928216
"Ontario Issues 1,666 Canada Immigration Invitations To International Graduates",0.0,2024-07-10 20:19:55.945371
The encampment is gone. Protesters say McGill went about it the wrong way,-0.6124,2024-07-10 20:19:55.945371
How the historic Canadian men's Olympic roster came together,0.0,2024-07-10 20:19:55.945371
Over 300 properties on alert as dozens of new B.C. wildfires burn,0.296,2024-07-10 20:19:55.961451
Happy Belated Canada Day! Barrhaven Is A True Reflection Of Our Nation,0.7777,2024-07-10 21:19:45.391596
EDITORIAL: How should Canada play its role on the world’s stage,0.34,2024-07-10 21:19:45.407336
NATO summit: Canada to buy up to 12 conventional submarines for Arctic defence,0.1027,2024-07-10 21:19:45.422934
Costco memberships are going up in Canada,0.0,2024-07-10 21:19:45.438555
Colombia advances to Copa America final; Uruguay to meet Canada for third,0.0,2024-07-10 21:19:55.911666
‘Increases’: Costco announces changes to membership fees in Canada and people online have mixed reactions,0.0,2024-07-10 21:19:55.945371
Forge defeats slumping Toronto FC in opening leg of Canadian Championship semifinal,0.1531,2024-07-10 22:19:45.438555
Canada pledges nearly $370 million in military aid for Ukraine.,0.0,2024-07-10 22:19:55.961451
"NATO confirms F-16s for Ukraine, Canada announces plans for new sub fleet",0.0,2024-07-10 22:19:55.966502
Bold Experiment or Safety Risk? Canada Is Divided on How to Stop Drug Deaths.,0.2732,2024-07-10 23:19:55.945371
"Steph Curry, Anthony Davis lead Team USA in exhibition game vs. Canada / News",0.0,2024-07-11 00:19:45.407336
Vancouver fans proud of Canada despite loss to Argentina in historic soccer game,0.6202,2024-07-11 00:19:45.422934
How does Canada stack up with Uruguay?,0.0,2024-07-11 00:19:45.422934
U.S. tops Canada in Olympic men's basketball exhibition,0.5106,2024-07-11 00:19:55.895030
Whitecaps edge Pacific FC in Canadian Championship semifinal,0.4404,2024-07-11 00:19:55.911666
USA Basketball tops Canada 86-72 in exhibition opener on the road to Paris Olympics,0.5106,2024-07-11 00:19:55.911666
Team USA defeats medal contender Canada in first Olympic basketball tune-up,0.3182,2024-07-11 00:19:55.911666
USA defeat Canada in summer premiere,-0.4588,2024-07-11 00:19:55.911666
Canada vs. United States Highlights | USA Basketball Showcase,0.4215,2024-07-11 00:19:55.928216
Canada takes step to acquire up to 12 submarines to guard Arctic,0.0,2024-07-11 00:19:55.928216
Canada loses to U.S. in first Olympic tune-up game,-0.3182,2024-07-11 00:19:55.928216
Team USA shakes off slow start to beat Canada in pre-Olympics exhibition opener,0.0,2024-07-11 00:19:55.945371
"Steph Curry, LeBron James, Anthony Davis Impress Fans in Team USA Win vs. SGA, Canada",0.7717,2024-07-11 00:19:55.966502
Canada soccer coach Jesse Marsch says he has no interest in vacant U.S. position,0.2023,2024-07-11 01:19:45.407336
"USA vs Canada score updates: Time, TV channel, streaming for USA Basketball Showcase",0.0,2024-07-11 01:19:55.928216
USA Open Showcase with 86-72 Win over Canada,0.5859,2024-07-11 01:19:55.945371
"Team USA showcases defense, tops Canada in Olympic tuneup",0.5859,2024-07-11 02:19:45.407336
CTV National News: Extreme weather in Canada,0.0,2024-07-11 02:19:45.422934
CTV National News: Canada's NATO commitments,0.128,2024-07-11 02:19:45.438555
"Oppressive heat poses health risk in Atlantic Canada, could topple records",-0.5859,2024-07-11 02:19:45.448172
Canada trying to find rhythm after loss to U.S. in first Olympic tune-up,-0.3182,2024-07-11 02:19:55.911666
