title,datetime,link
Star Wars Outlaws Wants to Be Your Dream 'Open Galaxy' - IGN First,2024-07-09 16:31:20.283404,news.google.com/articles/CBMiW2h0dHBzOi8vd3d3Lmlnbi5jb20vYXJ0aWNsZXMvc3Rhci13YXJzLW91dGxhd3Mtd2FudHMtdG8tYmUteW91ci1kcmVhbS1vcGVuLWdhbGF4eS1pZ24tZmlyc3TSAQA?hl=en-CA&gl=CA&ceid=CA%3Aen
Topic: Relations with Ukraine,2024-07-09 16:31:20.283404,news.google.com/articles/CBMiM2h0dHBzOi8vd3d3Lm5hdG8uaW50L2Nwcy9lbi9uYXRvaHEvdG9waWNzXzM3NzUwLmh0bdIBAA?hl=en-CA&gl=CA&ceid=CA%3Aen
High Commissioner Türk provides update on Ukraine: “War is the worst enemy of human rights”,2024-07-09 16:31:20.283404,news.google.com/articles/CBMid2h0dHBzOi8vd3d3Lm9oY2hyLm9yZy9lbi9zdGF0ZW1lbnRzLWFuZC1zcGVlY2hlcy8yMDI0LzA3L2hpZ2gtY29tbWlzc2lvbmVyLXR1cmstcHJvdmlkZXMtdXBkYXRlLXVrcmFpbmUtd2FyLXdvcnN0LWVuZW150gEA?hl=en-CA&gl=CA&ceid=CA%3Aen
Families of Indians duped into Russia’s war hope Modi will bring them home,2024-07-09 16:31:20.293488,news.google.com/articles/CBMicWh0dHBzOi8vd3d3LmFsamF6ZWVyYS5jb20vbmV3cy8yMDI0LzcvOS9mYW1pbGllcy1vZi1pbmRpYW5zLWR1cGVkLWludG8tcnVzc2lhcy13YXItaG9wZS1tb2RpLXdpbGwtYnJpbmctdGhlbS1ob21l0gF1aHR0cHM6Ly93d3cuYWxqYXplZXJhLmNvbS9hbXAvbmV3cy8yMDI0LzcvOS9mYW1pbGllcy1vZi1pbmRpYW5zLWR1cGVkLWludG8tcnVzc2lhcy13YXItaG9wZS1tb2RpLXdpbGwtYnJpbmctdGhlbS1ob21l?hl=en-CA&gl=CA&ceid=CA%3Aen
'Otherworldly' Portuguese man-of-war becoming more common on Nova Scotia's inshore,2024-07-09 16:31:20.293488,news.google.com/articles/CBMiYmh0dHBzOi8vd3d3LmNiYy5jYS9uZXdzL2NhbmFkYS9ub3ZhLXNjb3RpYS9wb3J0dWd1ZXNlLW1hbi1vZi13YXItbW9yZS1jb21tb24tbm92YS1zY290aWEtMS43MjU3ODAx0gEgaHR0cHM6Ly93d3cuY2JjLmNhL2FtcC8xLjcyNTc4MDE?hl=en-CA&gl=CA&ceid=CA%3Aen
Israel war on Gaza updates: Israeli attack on Gaza school kills dozens,2024-07-09 16:31:20.295502,news.google.com/articles/CBMieWh0dHBzOi8vd3d3LmFsamF6ZWVyYS5jb20vbmV3cy9saXZlYmxvZy8yMDI0LzcvOS9pc3JhZWxzLXdhci1vbi1nYXphLWxpdmUtdHdvLWdhemEtY2l0eS1ob3NwaXRhbHMtY2xvc2Utb24taXNyYWVsaS1vcmRlcnPSAQA?hl=en-CA&gl=CA&ceid=CA%3Aen
"‘War cannot solve problems,’ India’s PM Modi tells Russia’s Putin",2024-07-09 16:31:20.295502,news.google.com/articles/CBMiXmh0dHBzOi8vd3d3LmFsamF6ZWVyYS5jb20vbmV3cy8yMDI0LzcvOS93YXItY2Fubm90LXNvbHZlLXByb2JsZW1zLWluZGlhcy1wbS1tb2RpLXRlbGxzLXJ1c3NpYXPSAWJodHRwczovL3d3dy5hbGphemVlcmEuY29tL2FtcC9uZXdzLzIwMjQvNy85L3dhci1jYW5ub3Qtc29sdmUtcHJvYmxlbXMtaW5kaWFzLXBtLW1vZGktdGVsbHMtcnVzc2lhcw?hl=en-CA&gl=CA&ceid=CA%3Aen
Gaza hostage-ceasefire deal faces new hurdles as Israel sets conditions. Here’s what to know,2024-07-09 16:31:20.303537,news.google.com/articles/CBMidGh0dHBzOi8vd3d3LmNubi5jb20vMjAyNC8wNy8wOC9taWRkbGVlYXN0L2lzcmFlbC1oYW1hcy1jZWFzZWZpcmUtaG9zdGFnZS1kZWFsLWRlbWFuZHMtZXhwbGFpbmVyLW1pbWUtaW50bC9pbmRleC5odG1s0gFtaHR0cHM6Ly9hbXAuY25uLmNvbS9jbm4vMjAyNC8wNy8wOC9taWRkbGVlYXN0L2lzcmFlbC1oYW1hcy1jZWFzZWZpcmUtaG9zdGFnZS1kZWFsLWRlbWFuZHMtZXhwbGFpbmVyLW1pbWUtaW50bA?hl=en-CA&gl=CA&ceid=CA%3Aen
"Israeli protesters block highways, call for cease-fire to return hostages 9 months into war in Gaza",2024-07-09 16:31:20.303537,news.google.com/articles/CBMicGh0dHBzOi8vYWJjbmV3cy5nby5jb20vSW50ZXJuYXRpb25hbC93aXJlU3RvcnkvaXNyYWVsaS1wcm90ZXN0ZXJzLWJsb2NrLWhpZ2h3YXlzLWNhbGwtY2Vhc2UtZmlyZS1icmluZy0xMTE3MjQ0ODbSAXRodHRwczovL2FiY25ld3MuZ28uY29tL2FtcC9JbnRlcm5hdGlvbmFsL3dpcmVTdG9yeS9pc3JhZWxpLXByb3Rlc3RlcnMtYmxvY2staGlnaHdheXMtY2FsbC1jZWFzZS1maXJlLWJyaW5nLTExMTcyNDQ4Ng?hl=en-CA&gl=CA&ceid=CA%3Aen
"War, Elections, And Summitry",2024-07-09 16:31:20.308624,news.google.com/articles/CBMibmh0dHBzOi8vd3d3LnJmZXJsLm9yZy9hL2d1dHRlcm1hbi1wb2RjYXN0LXJ1c3NpYS13ZWVrLWFoZWFkLWdvdWxkLWRhdmllcy1uYXRvLXN1bW1pdC11a3JhaW5lLXdhci8zMzAyODMzMi5odG1s0gFwaHR0cHM6Ly93d3cucmZlcmwub3JnL2FtcC9ndXR0ZXJtYW4tcG9kY2FzdC1ydXNzaWEtd2Vlay1haGVhZC1nb3VsZC1kYXZpZXMtbmF0by1zdW1taXQtdWtyYWluZS13YXIvMzMwMjgzMzIuaHRtbA?hl=en-CA&gl=CA&ceid=CA%3Aen
"In Olympics push, France ramps up war on fake fashion",2024-07-09 16:31:20.308624,news.google.com/articles/CBMiYGh0dHBzOi8vd3d3LnJldXRlcnMuY29tL3dvcmxkL2V1cm9wZS9kZWphLXZ1LW9seW1waWNzLXB1c2gtZnJhbmNlLXJhbXBzLXVwLXdhci1mYWtlcy0yMDI0LTA3LTA5L9IBAA?hl=en-CA&gl=CA&ceid=CA%3Aen
Why Israel should avoid a war with Hizbullah,2024-07-09 16:31:20.313270,news.google.com/articles/CBMiWmh0dHBzOi8vd3d3LmVjb25vbWlzdC5jb20vcG9kY2FzdHMvMjAyNC8wNy8wOS93aHktaXNyYWVsLXNob3VsZC1hdm9pZC1hLXdhci13aXRoLWhpemJ1bGxhaNIBAA?hl=en-CA&gl=CA&ceid=CA%3Aen
NATO needs a realistic plan for ending the Ukraine war,2024-07-09 16:31:20.318319,news.google.com/articles/CBMic2h0dHBzOi8vdGhlaGlsbC5jb20vb3Bpbmlvbi9pbnRlcm5hdGlvbmFsLzQ3NTk5NzMtbWFrZS10aGUtbmF0by1zdW1taXQtYS1zdWNjZXNzLXdpdGgtYS1yZWFsaXN0aWMtcGxhbi1mb3ItdWtyYWluZS_SAXdodHRwczovL3RoZWhpbGwuY29tL29waW5pb24vaW50ZXJuYXRpb25hbC80NzU5OTczLW1ha2UtdGhlLW5hdG8tc3VtbWl0LWEtc3VjY2Vzcy13aXRoLWEtcmVhbGlzdGljLXBsYW4tZm9yLXVrcmFpbmUvYW1wLw?hl=en-CA&gl=CA&ceid=CA%3Aen
"After nine months of war in Gaza, another UN school suffers Israeli airstrike",2024-07-09 16:31:20.318319,news.google.com/articles/CBMiZ2h0dHBzOi8vdHVya2l5ZS51bi5vcmcvZW4vMjczNTU4LWFmdGVyLW5pbmUtbW9udGhzLXdhci1nYXphLWFub3RoZXItdW4tc2Nob29sLXN1ZmZlcnMtaXNyYWVsaS1haXJzdHJpa2XSAQA?hl=en-CA&gl=CA&ceid=CA%3Aen
Statue honouring Sask. war veterans' bravery on D-Day viewed in Regina,2024-07-09 16:31:20.318319,news.google.com/articles/CBMiU2h0dHBzOi8vY2EubmV3cy55YWhvby5jb20vc3RhdHVlLWhvbm91cmluZy1zYXNrYXRjaGV3YW4td2FyLXZldGVyYW5zLTE4MzgwNDgzMS5odG1s0gEA?hl=en-CA&gl=CA&ceid=CA%3Aen
Explainer-Why is Russia changing its language about the war?,2024-07-09 16:31:20.323405,news.google.com/articles/CBMiT2h0dHBzOi8vY2EubmV3cy55YWhvby5jb20vZXhwbGFpbmVyLXdoeS1ydXNzaWEtY2hhbmdpbmctbGFuZ3VhZ2UtMTU0OTE3NDkwLmh0bWzSAQA?hl=en-CA&gl=CA&ceid=CA%3Aen
These Corporations Are the True “Winners” of the War on Gaza,2024-07-09 16:31:20.323405,news.google.com/articles/CBMiS2h0dHBzOi8vd3d3LnRoZW5hdGlvbi5jb20vYXJ0aWNsZS9hcmNoaXZlL2dhemEtd2FyLXByb2ZpdGVlcnMtY29ycG9yYXRpb25zL9IBAA?hl=en-CA&gl=CA&ceid=CA%3Aen
Poland’s Last Few MiG-29s Could Go To War In Ukraine,2024-07-09 16:31:20.323405,news.google.com/articles/CBMiZWh0dHBzOi8vd3d3LmZvcmJlcy5jb20vc2l0ZXMvZGF2aWRheGUvMjAyNC8wNy8wOS9wb2xhbmRzLWxhc3QtZmV3LW1pZy0yOXMtY291bGQtZ28tdG8td2FyLWluLXVrcmFpbmUv0gEA?hl=en-CA&gl=CA&ceid=CA%3Aen
"Modi tells Putin: War cannot solve Ukraine crisis, death of children ‘painful’",2024-07-09 16:31:20.323405,news.google.com/articles/CBMib2h0dHBzOi8vZ2xvYmFsbmV3cy5jYS92aWRlby8xMDYxMjY5My9tb2RpLXRlbGxzLXB1dGluLXdhci1jYW5ub3Qtc29sdmUtdWtyYWluZS1jcmlzaXMtZGVhdGgtb2YtY2hpbGRyZW4tcGFpbmZ1bNIBdGh0dHBzOi8vZ2xvYmFsbmV3cy5jYS92aWRlby8xMDYxMjY5My9tb2RpLXRlbGxzLXB1dGluLXdhci1jYW5ub3Qtc29sdmUtdWtyYWluZS1jcmlzaXMtZGVhdGgtb2YtY2hpbGRyZW4tcGFpbmZ1bC9hbXAv?hl=en-CA&gl=CA&ceid=CA%3Aen
What I Learned in Beirut About How to Halt an Israel-Hezbollah War,2024-07-09 16:31:20.326933,news.google.com/articles/CBMitwFodHRwczovL3d3dy5oYWFyZXR6LmNvbS9taWRkbGUtZWFzdC1uZXdzLzIwMjQtMDctMDkvdHktYXJ0aWNsZS1vcGluaW9uLy5wcmVtaXVtL3doYXQtaS1sZWFybmVkLWluLWJlaXJ1dC1hYm91dC1ob3ctdG8taGFsdC1hbi1pc3JhZWwtaGV6Ym9sbGFoLXdhci8wMDAwMDE5MC05Mjc5LWQxYzUtYTFkNi1iYWZkZDgyNDAwMDDSAQA?hl=en-CA&gl=CA&ceid=CA%3Aen
NATO’s Biggest Test Since the Cold War Is Still Ahead,2024-07-09 16:31:20.326933,news.google.com/articles/CBMiTWh0dHBzOi8vY2FybmVnaWVlbmRvd21lbnQub3JnL2VtaXNzYXJ5LzIwMjQvMDcvbmF0by1zdW1taXQtdWtyYWluZS1ydXNzaWEtd2Fy0gEA?hl=en-CA&gl=CA&ceid=CA%3Aen
What South Korea Can Accomplish at NATO To Help End the War in Ukraine,2024-07-09 16:31:20.326933,news.google.com/articles/CBMiZ2h0dHBzOi8vdGhlZGlwbG9tYXQuY29tLzIwMjQvMDcvd2hhdC1zb3V0aC1rb3JlYS1jYW4tYWNjb21wbGlzaC1hdC1uYXRvLXRvLWhlbHAtZW5kLXRoZS13YXItaW4tdWtyYWluZS_SAQA?hl=en-CA&gl=CA&ceid=CA%3Aen
"The few can beat the many, Taiwan president says ahead of annual war games",2024-07-09 16:31:20.326933,news.google.com/articles/CBMidWh0dHBzOi8vd3d3LnJldXRlcnMuY29tL3dvcmxkL2FzaWEtcGFjaWZpYy9mZXctY2FuLWJlYXQtbWFueS10YWl3YW4tcHJlc2lkZW50LXNheXMtYWhlYWQtYW5udWFsLXdhci1nYW1lcy0yMDI0LTA3LTA5L9IBAA?hl=en-CA&gl=CA&ceid=CA%3Aen
"Despite hardships brought by war, flowers fill Kyiv and other Ukrainian cities",2024-07-09 16:31:20.331720,news.google.com/articles/CBMibmh0dHBzOi8vYWJjbmV3cy5nby5jb20vSW50ZXJuYXRpb25hbC93aXJlU3RvcnkvcHJlY2lvdXMtbW9tZW50LXRpbWUtd2FyLWZsb3dlcnMtd2lmZS1kYXVnaHRlci1jb21pbmctMTExNjY2NzQ10gFyaHR0cHM6Ly9hYmNuZXdzLmdvLmNvbS9hbXAvSW50ZXJuYXRpb25hbC93aXJlU3RvcnkvcHJlY2lvdXMtbW9tZW50LXRpbWUtd2FyLWZsb3dlcnMtd2lmZS1kYXVnaHRlci1jb21pbmctMTExNjY2NzQ1?hl=en-CA&gl=CA&ceid=CA%3Aen
Diplomacy wars: Orbán’s new nemesis arranges visit to Ukraine,2024-07-09 16:31:20.333745,news.google.com/articles/CBMic2h0dHBzOi8vd3d3LnBvbGl0aWNvLmV1L2FydGljbGUvaHVuZ2FyeS1kaXBsb21hY3ktd2Fycy12aWt0b3Itb3JiYW4tYWxseS10dXJuZWQtbmVtZXNpcy1wZXRlci1tYWd5YXItdmlzaXQtdWtyYWluZS_SAQA?hl=en-CA&gl=CA&ceid=CA%3Aen
"Russia-Ukraine war: killers of children in hospital the ‘dregs of humanity’, says Czech minister, as Russian ambassador is summoned – as it happened",2024-07-09 16:31:20.333959,news.google.com/articles/CBMie2h0dHBzOi8vd3d3LnRoZWd1YXJkaWFuLmNvbS93b3JsZC9saXZlLzIwMjQvanVsLzA5L3VrcmFpbmUtd2FyLWxpdmUta3lpdi1uYXRvLXZsYWRpbWlyLXB1dGluLXZvbGR5bXlyLXplbGVuc2tpeS1sYXRlc3QtbmV3c9IBe2h0dHBzOi8vYW1wLnRoZWd1YXJkaWFuLmNvbS93b3JsZC9saXZlLzIwMjQvanVsLzA5L3VrcmFpbmUtd2FyLWxpdmUta3lpdi1uYXRvLXZsYWRpbWlyLXB1dGluLXZvbGR5bXlyLXplbGVuc2tpeS1sYXRlc3QtbmV3cw?hl=en-CA&gl=CA&ceid=CA%3Aen
"Australia appoints special envoys as antisemitism, Islamophobia rise over Gaza war",2024-07-09 16:31:20.333959,news.google.com/articles/CBMiZ2h0dHBzOi8vd3d3LmNubi5jb20vMjAyNC8wNy8wOS9hdXN0cmFsaWEvYXVzdHJhbGlhLWVudm95cy1hbnRpc2VtaXRpc20taXNsYW1vcGhvYmlhLWludGwtaG5rL2luZGV4Lmh0bWzSAWBodHRwczovL2FtcC5jbm4uY29tL2Nubi8yMDI0LzA3LzA5L2F1c3RyYWxpYS9hdXN0cmFsaWEtZW52b3lzLWFudGlzZW1pdGlzbS1pc2xhbW9waG9iaWEtaW50bC1obms?hl=en-CA&gl=CA&ceid=CA%3Aen
"Russia's war threatens Ukraine's Olympic future, not just the present. A young gymnast offers hope",2024-07-09 16:31:20.333959,news.google.com/articles/CBMibWh0dHBzOi8vYWJjbmV3cy5nby5jb20vU3BvcnRzL3dpcmVTdG9yeS9ydXNzaWFzLXdhci10aHJlYXRlbnMtdWtyYWluZXMtb2x5bXBpYy1mdXR1cmUtcHJlc2VudC15b3VuZy0xMTE3NjgxMjTSAXFodHRwczovL2FiY25ld3MuZ28uY29tL2FtcC9TcG9ydHMvd2lyZVN0b3J5L3J1c3NpYXMtd2FyLXRocmVhdGVucy11a3JhaW5lcy1vbHltcGljLWZ1dHVyZS1wcmVzZW50LXlvdW5nLTExMTc2ODEyNA?hl=en-CA&gl=CA&ceid=CA%3Aen
"Russia's war threatens Ukraine's Olympic future, not just the present. A young gymnast offers hope",2024-07-09 16:31:20.333959,news.google.com/articles/CBMiVmh0dHBzOi8vYXBuZXdzLmNvbS9hcnRpY2xlL3VrcmFpbmUtd2FyLXBhcmlzLW9seW1waWNzLTRmM2RkMjhjMzIyMTNiNzQ5NmYxMThkMTBlYmVmZDJl0gEA?hl=en-CA&gl=CA&ceid=CA%3Aen
"Ukraine war latest: Missile that struck children's hospital was Russian, Sky News finds; Modi rebukes Putin during visit",2024-07-09 16:31:20.333959,news.google.com/articles/CBMiXmh0dHBzOi8vbmV3cy5za3kuY29tL3N0b3J5L3VrcmFpbmUtcnVzc2lhLXdhci1sYXRlc3QtcHV0aW4tbGl2ZS11cGRhdGVzLXNreS1uZXdzLWJsb2ctMTI1NDE3MTPSAQA?hl=en-CA&gl=CA&ceid=CA%3Aen
India's Modi tells Putin that 'heart bleeds' over deaths of children in war,2024-07-09 16:31:20.333959,news.google.com/articles/CBMiZ2h0dHBzOi8vd3d3LnJldXRlcnMuY29tL3dvcmxkL21vZGktdGVsbHMtcHV0aW4tdGhhdC1kZWF0aC1pbm5vY2VudC1jaGlsZHJlbi1pcy12ZXJ5LXBhaW5mdWwtMjAyNC0wNy0wOS_SAQA?hl=en-CA&gl=CA&ceid=CA%3Aen
Narendra Modi and Vladimir Putin to boost trade despite Ukraine war,2024-07-09 16:31:20.338491,news.google.com/articles/CBMiP2h0dHBzOi8vd3d3LmZ0LmNvbS9jb250ZW50L2Q3MGU3MzY3LTAxMTMtNDljNC04MWJlLTBjNWMzZWRjYmZmZdIBAA?hl=en-CA&gl=CA&ceid=CA%3Aen
UK Labour Defence Secretary visits Ukraine to back escalated war,2024-07-09 16:31:20.338491,news.google.com/articles/CBMiOWh0dHBzOi8vd3d3Lndzd3Mub3JnL2VuL2FydGljbGVzLzIwMjQvMDcvMDkveXRzcC1qMDkuaHRtbNIBAA?hl=en-CA&gl=CA&ceid=CA%3Aen
White House: India has ability to urge Putin to end war in Ukraine,2024-07-09 16:31:20.338491,news.google.com/articles/CBMiYmh0dHBzOi8vd3d3LnJldXRlcnMuY29tL3dvcmxkL3doaXRlLWhvdXNlLWluZGlhLWhhcy1hYmlsaXR5LXVyZ2UtcHV0aW4tZW5kLXdhci11a3JhaW5lLTIwMjQtMDctMDkv0gEA?hl=en-CA&gl=CA&ceid=CA%3Aen
‘Civil War’ Purchase And Rental Prices Drop On Digital Streaming,2024-07-09 16:31:20.338491,news.google.com/articles/CBMicmh0dHBzOi8vd3d3LmZvcmJlcy5jb20vc2l0ZXMvdGltbGFtbWVycy8yMDI0LzA3LzA5L2NpdmlsLXdhci1wdXJjaGFzZS1hbmQtcmVudGFsLXByaWNlcy1kcm9wLW9uLWRpZ2l0YWwtc3RyZWFtaW5nL9IBAA?hl=en-CA&gl=CA&ceid=CA%3Aen
"'Civil War' review: Alex Garland's latest is more 'Men,' less 'Ex Machina'",2024-07-09 16:31:20.338491,news.google.com/articles/CBMiM2h0dHBzOi8vbWFzaGFibGUuY29tL2FydGljbGUvY2l2aWwtd2FyLW1vdmllLXJldmlld9IBAA?hl=en-CA&gl=CA&ceid=CA%3Aen
"Putin hosts India’s prime minister in Russia to deepen ties, but war in Ukraine looms",2024-07-09 16:31:20.338491,news.google.com/articles/CBMidmh0dHBzOi8vd3d3LnBicy5vcmcvbmV3c2hvdXIvd29ybGQvcHV0aW4taG9zdHMtaW5kaWFzLXByaW1lLW1pbmlzdGVyLWluLXJ1c3NpYS10by1kZWVwZW4tdGllcy1idXQtd2FyLWluLXVrcmFpbmUtbG9vbXPSAXpodHRwczovL3d3dy5wYnMub3JnL25ld3Nob3VyL2FtcC93b3JsZC9wdXRpbi1ob3N0cy1pbmRpYXMtcHJpbWUtbWluaXN0ZXItaW4tcnVzc2lhLXRvLWRlZXBlbi10aWVzLWJ1dC13YXItaW4tdWtyYWluZS1sb29tcw?hl=en-CA&gl=CA&ceid=CA%3Aen
Israeli forces push deeper into Gaza City as Hamas warns that escalation threatens cease-fire talks,2024-07-09 16:31:20.338491,news.google.com/articles/CBMiaWh0dHBzOi8vYXBuZXdzLmNvbS9hcnRpY2xlL2lzcmFlbC1wYWxlc3RpbmlhbnMtaGFtYXMtd2FyLW5ld3MtMDctMDgtMjAyNC05ZjRmMDMwYzljNzU4ZjFhYjljZTQ3NTA5NmIzNTM0ZNIBAA?hl=en-CA&gl=CA&ceid=CA%3Aen
US needs smarter policies to avoid a China war,2024-07-09 16:31:20.343036,news.google.com/articles/CBMiTWh0dHBzOi8vYXNpYXRpbWVzLmNvbS8yMDI0LzA3L3VzLW5lZWRzLXNtYXJ0ZXItcG9saWNpZXMtdG8tYXZvaWQtYS1jaGluYS13YXIv0gEA?hl=en-CA&gl=CA&ceid=CA%3Aen
Total War: Pharaoh's enormous free Dynasties update gets a July release date and trailer,2024-07-09 16:31:20.344095,news.google.com/articles/CBMid2h0dHBzOi8vd3d3LnJvY2twYXBlcnNob3RndW4uY29tL3RvdGFsLXdhci1waGFyb2Focy1lbm9ybW91cy1mcmVlLWR5bmFzdGllcy11cGRhdGUtZ2V0cy1hLWp1bHktcmVsZWFzZS1kYXRlLWFuZC10cmFpbGVy0gEA?hl=en-CA&gl=CA&ceid=CA%3Aen
US accuses Iran of exploiting anti-war protests on university campuses,2024-07-09 16:31:20.344095,news.google.com/articles/CBMiKGh0dHBzOi8vd3d3LmlyYW5pbnRsLmNvbS9lbi8yMDI0MDcwOTk2OTbSAQA?hl=en-CA&gl=CA&ceid=CA%3Aen
House keys carry symbolic weight for Palestinians families repeatedly displaced by war,2024-07-09 16:31:20.344095,news.google.com/articles/CBMiWGh0dHBzOi8vYXBuZXdzLmNvbS9hcnRpY2xlL2dhemEtZGlzcGxhY2VtZW50LWlzcmFlbC13YXItOTAwYzRiYWNmNzAwODAyNDllYThlNjJmODE4YzQxMGbSAQA?hl=en-CA&gl=CA&ceid=CA%3Aen
The Holocaust Survivor Who Put His Faith in War Crimes Law,2024-07-09 16:31:20.344095,news.google.com/articles/CBMiXWh0dHBzOi8vbmV3bGluZXNtYWcuY29tL3JlcG9ydGFnZS90aGUtaG9sb2NhdXN0LXN1cnZpdm9yLXdoby1wdXQtaGlzLWZhaXRoLWluLXdhci1jcmltZXMtbGF3L9IBAA?hl=en-CA&gl=CA&ceid=CA%3Aen
War in Ukraine threatens its Olympic future — but a young amputee gymnast stays hopeful,2024-07-09 16:31:20.348651,news.google.com/articles/CBMigwFodHRwczovL3d3dy5ldXJvbmV3cy5jb20vbXktZXVyb3BlLzIwMjQvMDcvMDkvd2FyLWluLXVrcmFpbmUtdGhyZWF0ZW5zLWl0cy1vbHltcGljLWZ1dHVyZS1idXQtYS15b3VuZy1hbXB1dGVlLWd5bW5hc3Qtc3RheXMtaG9wZWZ1bNIBAA?hl=en-CA&gl=CA&ceid=CA%3Aen
Turkey’s Erdogan Cautions NATO Against Being Dragged Into War in Ukraine,2024-07-09 16:31:20.348651,news.google.com/articles/CBMie2h0dHBzOi8vd3d3LmJsb29tYmVyZy5jb20vbmV3cy9hcnRpY2xlcy8yMDI0LTA3LTA5L3R1cmtleS1zLWVyZG9nYW4tY2F1dGlvbnMtbmF0by1hZ2FpbnN0LWJlaW5nLWRyYWdnZWQtaW50by13YXItaW4tdWtyYWluZdIBAA?hl=en-CA&gl=CA&ceid=CA%3Aen
"Ukraine war latest: Rescue operations end at Kyiv children's hospital, at least 33 killed in capital overall",2024-07-09 16:31:20.348651,news.google.com/articles/CBMiMmh0dHBzOi8va3lpdmluZGVwZW5kZW50LmNvbS91a3JhaW5lLXdhci1sYXRlc3QtMTYv0gEA?hl=en-CA&gl=CA&ceid=CA%3Aen
Jersey War Tunnels marks fourth yearly awards win,2024-07-09 16:31:20.348651,news.google.com/articles/CBMiLmh0dHBzOi8vd3d3LmJiYy5jb20vbmV3cy9hcnRpY2xlcy9jcmc3OGt5eDN5MG_SATJodHRwczovL3d3dy5iYmMuY29tL25ld3MvYXJ0aWNsZXMvY3JnNzhreXgzeTBvLmFtcA?hl=en-CA&gl=CA&ceid=CA%3Aen
UN rights chief calls for end to war on Ukraine following latest airstrikes,2024-07-09 16:31:20.353327,news.google.com/articles/CBMiLGh0dHBzOi8vbmV3cy51bi5vcmcvZW4vc3RvcnkvMjAyNC8wNy8xMTUxOTAx0gEA?hl=en-CA&gl=CA&ceid=CA%3Aen
"Sudan, Saudi Arabia discuss revival of peace talks to end civil war",2024-07-09 16:31:20.353327,news.google.com/articles/CBMibmh0dHBzOi8vd3d3Lm1pZGRsZWVhc3Rtb25pdG9yLmNvbS8yMDI0MDcwOS1zdWRhbi1zYXVkaS1hcmFiaWEtZGlzY3Vzcy1yZXZpdmFsLW9mLXBlYWNlLXRhbGtzLXRvLWVuZC1jaXZpbC13YXIv0gFyaHR0cHM6Ly93d3cubWlkZGxlZWFzdG1vbml0b3IuY29tLzIwMjQwNzA5LXN1ZGFuLXNhdWRpLWFyYWJpYS1kaXNjdXNzLXJldml2YWwtb2YtcGVhY2UtdGFsa3MtdG8tZW5kLWNpdmlsLXdhci9hbXAv?hl=en-CA&gl=CA&ceid=CA%3Aen
We’re in a class war. Jane McAlevey actually acted like it.,2024-07-09 16:31:20.358450,news.google.com/articles/CBMiUGh0dHBzOi8vdGhlcmVhbG5ld3MuY29tL3dlcmUtaW4tYS1jbGFzcy13YXItamFuZS1tY2FsZXZleS1hY3R1YWxseS1hY3RlZC1saWtlLWl00gEA?hl=en-CA&gl=CA&ceid=CA%3Aen
"Wounded Veterans, Wounded Economy: The Personnel Costs of Russia’s War",2024-07-09 16:31:20.359274,news.google.com/articles/CBMiZmh0dHBzOi8vd2Fyb250aGVyb2Nrcy5jb20vMjAyNC8wNy93b3VuZGVkLXZldGVyYW5zLXdvdW5kZWQtZWNvbm9teS10aGUtcGVyc29ubmVsLWNvc3RzLW9mLXJ1c3NpYXMtd2FyL9IBAA?hl=en-CA&gl=CA&ceid=CA%3Aen
The World War on Asylum,2024-07-09 16:31:20.359274,news.google.com/articles/CBMiOWh0dHBzOi8vdGhlaW50ZXJjZXB0LmNvbS8yMDI0LzA3LzA5L2FzeWx1bS1yaWdodHMtZ3JlZWNlL9IBAA?hl=en-CA&gl=CA&ceid=CA%3Aen
Civilian casualties rise in Myanmar's civil war as resistance forces tighten noose around military,2024-07-09 16:31:20.359274,news.google.com/articles/CBMiUGh0dHBzOi8vY2EubmV3cy55YWhvby5jb20vY2l2aWxpYW4tY2FzdWFsdGllcy1yaXNlLW15YW5tYXJzLWNpdmlsLTA0MTYxMDY4MS5odG1s0gEA?hl=en-CA&gl=CA&ceid=CA%3Aen
Gaza City ‘uninhabitable’ as UN experts blast Israeli ‘starvation campaign’,2024-07-09 16:31:20.359274,news.google.com/articles/CBMiiAFodHRwczovL3d3dy5hbGphemVlcmEuY29tL25ld3MvbGl2ZWJsb2cvMjAyNC83LzkvaXNyYWVscy13YXItb24tZ2F6YS1saXZlLXR3by1nYXphLWNpdHktaG9zcGl0YWxzLWNsb3NlLW9uLWlzcmFlbGktb3JkZXJzP3VwZGF0ZT0zMDM1NTQ00gEA?hl=en-CA&gl=CA&ceid=CA%3Aen
'It's timeless': Historic Second World War plane stops in Winnipeg,2024-07-09 17:31:20.283404,news.google.com/articles/CBMiZWh0dHBzOi8vd2lubmlwZWcuY3R2bmV3cy5jYS9pdC1zLXRpbWVsZXNzLWhpc3RvcmljLXNlY29uZC13b3JsZC13YXItcGxhbmUtc3RvcHMtaW4td2lubmlwZWctMS42OTU3MzA00gEA?hl=en-CA&gl=CA&ceid=CA%3Aen
"US defense secretary says war with China neither imminent nor unavoidable, stressing need for talks",2024-07-09 17:31:20.318319,news.google.com/articles/CBMiRmh0dHBzOi8vY2EubmV3cy55YWhvby5jb20vdXMtZGVmZW5zZS1zZWNyZXRhcnktc2F5cy13YXItMDM0MTQ0MzUwLmh0bWzSAQA?hl=en-CA&gl=CA&ceid=CA%3Aen
Lebanon's bloodthirsty leadership impacts a population not keen on war - opinion,2024-07-09 17:31:20.363359,news.google.com/articles/CBMiLGh0dHBzOi8vd3d3Lmpwb3N0LmNvbS9vcGluaW9uL2FydGljbGUtODA5NjQx0gEA?hl=en-CA&gl=CA&ceid=CA%3Aen
Ukraine war briefing: day of mourning in Kyiv after missile strike on children’s hospital,2024-07-09 18:31:20.283404,news.google.com/articles/CBMijQFodHRwczovL3d3dy50aGVndWFyZGlhbi5jb20vd29ybGQvYXJ0aWNsZS8yMDI0L2p1bC8wOS91a3JhaW5lLXdhci1icmllZmluZy1kYXktb2YtbW91cm5pbmctaW4ta3lpdi1hZnRlci1taXNzaWxlLXN0cmlrZS1vbi1jaGlsZHJlbnMtaG9zcGl0YWzSAY0BaHR0cHM6Ly9hbXAudGhlZ3VhcmRpYW4uY29tL3dvcmxkL2FydGljbGUvMjAyNC9qdWwvMDkvdWtyYWluZS13YXItYnJpZWZpbmctZGF5LW9mLW1vdXJuaW5nLWluLWt5aXYtYWZ0ZXItbWlzc2lsZS1zdHJpa2Utb24tY2hpbGRyZW5zLWhvc3BpdGFs?hl=en-CA&gl=CA&ceid=CA%3Aen
"NATO allies commit to sending dozens of air defense systems to Ukraine, including four Patriots",2024-07-09 18:31:20.313270,news.google.com/articles/CBMiY2h0dHBzOi8vYXBuZXdzLmNvbS9hcnRpY2xlL3VrcmFpbmUtbmF0by1zdW1taXQtcGF0cmlvdC1haXItZGVmZW5zZS02YmY2MzllM2E3NmU5ZWE4YWRiZGFkYWJkMjY2MDQ5MNIBAA?hl=en-CA&gl=CA&ceid=CA%3Aen
"If You Want To Go Down A “House Of The Dragon” Wormhole Today, Here Is A Spoiler-y Breakdown Of The Entire Targaryen Civil War",2024-07-09 18:31:20.331720,news.google.com/articles/CBMiW2h0dHBzOi8vd3d3LmJ1enpmZWVkLmNvbS9rYXJsdG9uamFobWFsL2hvdXNlLW9mLXRoZS1kcmFnb24tZnVsbC10YXJnYXJ5ZW4tY2l2aWwtd2FyLWhpc3RvcnnSAQA?hl=en-CA&gl=CA&ceid=CA%3Aen
"Iran is targeting Americans amid Gaza war protests, US intelligence chief warns",2024-07-09 19:31:20.326933,news.google.com/articles/CBMiiwFodHRwczovL3d3dy51c2F0b2RheS5jb20vc3RvcnkvbmV3cy9pbnZlc3RpZ2F0aW9ucy8yMDI0LzA3LzA5L3VzLXByb3Rlc3RlcnMtdGFyZ2V0ZWQtYnktaXJhbi1pbmZsdWVuY2UtY2FtcGFpZ24tb2ZmaWNpYWwtd2FybnMvNzQzNDI5ODEwMDcv0gEA?hl=en-CA&gl=CA&ceid=CA%3Aen
APTOPIX Russia Ukraine War,2024-07-09 19:31:20.333959,news.google.com/articles/CBMioAFodHRwczovL29zY2UudXNtaXNzaW9uLmdvdi9vbi1ydXNzaWFzLW1pc3NpbGUtYXR0YWNrcy1vbi11a3JhaW5lLWluY2x1ZGluZy1vbi1va2htYXRkeXQtY2hpbGRyZW5zLWhvc3BpdGFsLWluLWt5aXYtb24tOC1qdWx5LTIwMjQvYXB0b3BpeC1ydXNzaWEtdWtyYWluZS13YXItMjEv0gEA?hl=en-CA&gl=CA&ceid=CA%3Aen
"New York Times reveals Ukrainian war crimes, remains silent on paramilitaries’ ties to US state",2024-07-09 19:31:20.333959,news.google.com/articles/CBMiOWh0dHBzOi8vd3d3Lndzd3Mub3JnL2VuL2FydGljbGVzLzIwMjQvMDcvMDkveWd1ci1qMDkuaHRtbNIBAA?hl=en-CA&gl=CA&ceid=CA%3Aen
Sudan war: How a photographer escaped the besieged city of el-Fasher,2024-07-09 20:31:20.283404,news.google.com/articles/CBMiLmh0dHBzOi8vd3d3LmJiYy5jb20vbmV3cy9hcnRpY2xlcy9jNzIwenlrcGRlNG_SATJodHRwczovL3d3dy5iYmMuY29tL25ld3MvYXJ0aWNsZXMvYzcyMHp5a3BkZTRvLmFtcA?hl=en-CA&gl=CA&ceid=CA%3Aen
"Iran Update, July 9, 2024",2024-07-09 20:31:20.295502,news.google.com/articles/CBMiRWh0dHBzOi8vd3d3LnVuZGVyc3RhbmRpbmd3YXIub3JnL2JhY2tncm91bmRlci9pcmFuLXVwZGF0ZS1qdWx5LTktMjAyNNIBAA?hl=en-CA&gl=CA&ceid=CA%3Aen
UN experts say Israel carrying out ‘targeted starvation campaign’ in Gaza,2024-07-09 20:31:20.326933,news.google.com/articles/CBMib2h0dHBzOi8vd3d3LmFsamF6ZWVyYS5jb20vbmV3cy8yMDI0LzcvOS91bi1leHBlcnRzLXNheS1pc3JhZWwtY2Fycnlpbmctb3V0LXRhcmdldGVkLXN0YXJ2YXRpb24tY2FtcGFpZ24taW4tZ2F6YdIBc2h0dHBzOi8vd3d3LmFsamF6ZWVyYS5jb20vYW1wL25ld3MvMjAyNC83LzkvdW4tZXhwZXJ0cy1zYXktaXNyYWVsLWNhcnJ5aW5nLW91dC10YXJnZXRlZC1zdGFydmF0aW9uLWNhbXBhaWduLWluLWdhemE?hl=en-CA&gl=CA&ceid=CA%3Aen
Tour de France: Philipsen wins stage 10 as lead quartet ramp up war of words,2024-07-09 20:31:20.348651,news.google.com/articles/CBMiigFodHRwczovL3d3dy50aGVndWFyZGlhbi5jb20vc3BvcnQvYXJ0aWNsZS8yMDI0L2p1bC8wOS9qYXNwZXItcGhpbGlwc2VuLXNwcmludHMtY2xlYXItdG8tY2xhaW0tZmlyc3Qtc3RhZ2Utd2luLW9mLXRoaXMteWVhcnMtdG91ci1kZS1mcmFuY2XSAYoBaHR0cHM6Ly9hbXAudGhlZ3VhcmRpYW4uY29tL3Nwb3J0L2FydGljbGUvMjAyNC9qdWwvMDkvamFzcGVyLXBoaWxpcHNlbi1zcHJpbnRzLWNsZWFyLXRvLWNsYWltLWZpcnN0LXN0YWdlLXdpbi1vZi10aGlzLXllYXJzLXRvdXItZGUtZnJhbmNl?hl=en-CA&gl=CA&ceid=CA%3Aen
"Era of culture wars is over, pledges new culture secretary Lisa Nandy",2024-07-09 20:31:20.353327,news.google.com/articles/CBMifWh0dHBzOi8vd3d3LnRoZWd1YXJkaWFuLmNvbS9wb2xpdGljcy9hcnRpY2xlLzIwMjQvanVsLzA5L2VyYS1vZi1jdWx0dXJlLXdhcnMtaXMtb3Zlci1wbGVkZ2VzLW5ldy1jdWx0dXJlLXNlY3JldGFyeS1saXNhLW5hbmR50gF9aHR0cHM6Ly9hbXAudGhlZ3VhcmRpYW4uY29tL3BvbGl0aWNzL2FydGljbGUvMjAyNC9qdWwvMDkvZXJhLW9mLWN1bHR1cmUtd2Fycy1pcy1vdmVyLXBsZWRnZXMtbmV3LWN1bHR1cmUtc2VjcmV0YXJ5LWxpc2EtbmFuZHk?hl=en-CA&gl=CA&ceid=CA%3Aen
"Russian Offensive Campaign Assessment, July 9, 2024",2024-07-09 21:31:20.283404,news.google.com/articles/CBMiX2h0dHBzOi8vd3d3LnVuZGVyc3RhbmRpbmd3YXIub3JnL2JhY2tncm91bmRlci9ydXNzaWFuLW9mZmVuc2l2ZS1jYW1wYWlnbi1hc3Nlc3NtZW50LWp1bHktOS0yMDI00gEA?hl=en-CA&gl=CA&ceid=CA%3Aen
"Iran encourages Gaza war protests in US to stoke outrage and distrust, intelligence chief says",2024-07-09 21:31:20.283404,news.google.com/articles/CBMiZGh0dHBzOi8vYXBuZXdzLmNvbS9hcnRpY2xlL2dhemEtd2FyLXByb3Rlc3RzLWlyYW4tZm9yZWlnbi1pbmZsdWVuY2UtOTVlMGExNjExMTllZDBlMDYwMzMyZmVkYTk1YjRlNGbSAQA?hl=en-CA&gl=CA&ceid=CA%3Aen
Ukraine war latest: Biden addresses NATO summit after 'hell' of attack on Kyiv hospital,2024-07-09 21:31:20.293345,news.google.com/articles/CBMifGh0dHBzOi8vbmV3cy5za3kuY29tL3N0b3J5L3VrcmFpbmUtd2FyLWxhdGVzdC1ydXNzaWEtbGF1bmNoZXMtd2F2ZS1vZi1tb3JlLXRoYW4tMTAwLW1pc3NpbGVzLXJvY2tldHMtYW5kLWFpcnN0cmlrZXMtMTI1NDE3MTPSAQA?hl=en-CA&gl=CA&ceid=CA%3Aen
Zelenskyy says the world cannot wait until the US election in November to take action to repel Putin,2024-07-09 21:31:20.308624,news.google.com/articles/CBMiZGh0dHBzOi8vYXBuZXdzLmNvbS9hcnRpY2xlL3plbGVuc2t5eS11a3JhaW5lLW5hdG8tc3VtbWl0LXJ1c3NpYS13YXItN2Y2YTA0MmUzMjNhZjEwZTA0MjUyMzllYTVhMDIzYzPSAQA?hl=en-CA&gl=CA&ceid=CA%3Aen
Ukraine bets on land robots for next phase of war,2024-07-09 21:31:20.311231,news.google.com/articles/CBMiXWh0dHBzOi8vd3d3LmRlZmVuc2VvbmUuY29tL3RlY2hub2xvZ3kvMjAyNC8wNy91a3JhaW5lLWJldHMtbGFuZC1yb2JvdHMtbmV4dC1waGFzZS13YXIvMzk3OTI1L9IBAA?hl=en-CA&gl=CA&ceid=CA%3Aen
Ukraine mourns as rescuers search the rubble of a Kyiv children's hospital struck by a missile,2024-07-09 21:31:20.313270,news.google.com/articles/CBMibmh0dHBzOi8vYXBuZXdzLmNvbS9hcnRpY2xlL3J1c3NpYS11a3JhaW5lLXdhci1taXNzaWxlcy1jaGlsZHJlbi1ob3NwaXRhbC1reWl2LTBhMzNlZDE2YmFmMmM1MDliMjA1NzA1YmRkMTE1NWRi0gEA?hl=en-CA&gl=CA&ceid=CA%3Aen
"""Make No Mistake, Russia Failing In This War"": Joe Biden Slams Vladimir Putin",2024-07-09 21:31:20.331720,news.google.com/articles/CBMidGh0dHBzOi8vd3d3Lm5kdHYuY29tL3dvcmxkLW5ld3MvbWFrZS1uby1taXN0YWtlLXJ1c3NpYS1mYWlsaW5nLWluLXVrcmFpbmUtd2FyLWpvZS1iaWRlbi1zbGFtcy12bGFkaW1pci1wdXRpbi02MDcyMjM00gF6aHR0cHM6Ly93d3cubmR0di5jb20vd29ybGQtbmV3cy9tYWtlLW5vLW1pc3Rha2UtcnVzc2lhLWZhaWxpbmctaW4tdWtyYWluZS13YXItam9lLWJpZGVuLXNsYW1zLXZsYWRpbWlyLXB1dGluLTYwNzIyMzQvYW1wLzE?hl=en-CA&gl=CA&ceid=CA%3Aen
"Russia-Ukraine war: List of key events, day 866",2024-07-09 22:31:20.283404,news.google.com/articles/CBMiVmh0dHBzOi8vd3d3LmFsamF6ZWVyYS5jb20vbmV3cy8yMDI0LzcvMTAvcnVzc2lhLXVrcmFpbmUtd2FyLWxpc3Qtb2Yta2V5LWV2ZW50cy1kYXktODY20gFaaHR0cHM6Ly93d3cuYWxqYXplZXJhLmNvbS9hbXAvbmV3cy8yMDI0LzcvMTAvcnVzc2lhLXVrcmFpbmUtd2FyLWxpc3Qtb2Yta2V5LWV2ZW50cy1kYXktODY2?hl=en-CA&gl=CA&ceid=CA%3Aen
